{
  "$schema": "http://json-schema.org/draft-07/schema#",
  "title": "Rotisserie draft state",
  "type": "object",
  "required": ["generated_at", "source_digest", "cube", "rounds_total", "picks_total",
               "picks_made", "current_round", "players", "pools", "remaining", "log"],
  "properties": {
    "generated_at": { "type": "string" },
    "source_digest": { "type": "string", "pattern": "^sha256:[0-9a-f]{64}$" },
    "cube": { "type": "string", "minLength": 1 },
    "cube_size": { "type": "integer", "minimum": 1 },
    "rounds_total": { "type": "integer", "minimum": 1 },
    "picks_total": { "type": "integer", "minimum": 1 },
    "picks_made": { "type": "integer", "minimum": 0 },
    "current_round": { "type": "integer", "minimum": 1 },
    "next_player": { "type": ["string", "null"], "minLength": 1 },
    "players": { "type": "array", "minItems": 1, "items": { "type": "string", "minLength": 1 } },
    "pools": {
      "type": "object",
      "additionalProperties": { "type": "array", "items": { "type": "string" } }
    },
    "remaining": { "type": "array", "items": { "type": "string" } },
    "log": {
      "type": "array",
      "items": {
        "type": "object",
        "required": ["round", "seq", "player", "card"],
        "properties": {
          "round": { "type": "integer", "minimum": 1 },
          "seq": { "type": "integer", "minimum": 1 },
          "player": { "type": "string", "minLength": 1 },
          "card": { "type": "string", "minLength": 1 },
          "first_seen": { "type": "string" }
        }
      }
    }
  }
}
