{
  "generated_at": "2026-08-04T21:56:34Z",
  "source_digest": "sha256:686eeeb0a1094ba1917d93bca714538a9a54844f7e8dba523e991cf90228d823",
  "cube": "Meta Memories",
  "cube_size": 539,
  "rounds_total": 45,
  "picks_total": 360,
  "picks_made": 290,
  "current_round": 37,
  "next_player": "Tommi",
  "players": [
    "Binni",
    "Örvar",
    "Tommi",
    "Diddi",
    "Atli",
    "Óli",
    "Aron Ívars.",
    "Aron Freyr"
  ],
  "pools": {
    "Binni": [
      "Ragavan, Nimble Pilferer",
      "Birds of Paradise",
      "Ignoble Hierarch",
      "Llanowar Elves",
      "Hexdrinker",
      "Screaming Nemesis",
      "Glorybringer",
      "Nissa, Who Shakes the World",
      "Esika's Chariot",
      "Sylvan Caryatid",
      "Ziatora's Proving Ground",
      "Overgrown Tomb",
      "Up the Beanstalk",
      "Overlord of the Hauntwoods",
      "Overlord of the Balemurk",
      "Emperor of Bones",
      "Shriekmaw",
      "Scavenging Ooze",
      "Murderous Cut",
      "Blackcleave Cliffs",
      "Cut Down",
      "Sheoldred's Edict",
      "Fanatic of Rhonas",
      "Huntmaster of the Fells",
      "Tireless Tracker",
      "Boseiju, Who Endures",
      "Slaughter Pact",
      "Green Sun's Zenith",
      "Craterhoof Behemoth",
      "Deep-Cavern Bat",
      "Grief",
      "Nurturing Peatland",
      "Ouroboroid",
      "Assassin's Trophy",
      "Wastewood Verge",
      "Kalitas, Traitor of Ghet",
      "Grist, the Hunger Tide"
    ],
    "Örvar": [
      "Psychic Frog",
      "Lurrus of the Dream-Den",
      "Mishra's Bauble",
      "Marsh Flats",
      "Verdant Catacombs",
      "Thoughtseize",
      "Watery Grave",
      "Aether Spellbomb",
      "Raffine's Tower",
      "Mana Leak",
      "Dark Confidant",
      "Remand",
      "Malcolm, Alluring Scoundrel",
      "Pyrite Spellbomb",
      "Raucous Theater",
      "Undercity Sewers",
      "Deathrite Shaman",
      "Bone Shards",
      "Shadowy Backstreet",
      "Unearth",
      "Damnation",
      "Thraben Inspector",
      "Novice Inspector",
      "Pile On",
      "Caustic Bronco",
      "Celestial Colonnade",
      "Gloomlake Verge",
      "Supreme Verdict",
      "Selfless Spirit",
      "Malakir Rebirth",
      "Field of the Dead",
      "Jace, Vryn's Prodigy",
      "Jeskai Revelation",
      "Bleachbone Verge",
      "Elegant Parlor",
      "Valki, God of Lies",
      "Intimidation Tactics"
    ],
    "Tommi": [
      "Urza's Saga",
      "Urza, Lord High Artificer",
      "Agatha's Soul Cauldron",
      "Walking Ballista",
      "Steam Vents",
      "Hallowed Fountain",
      "Stoneforge Mystic",
      "Cryptic Coat",
      "Esper Sentinel",
      "Chromatic Star",
      "Erode",
      "Otawara, Soaring City",
      "Lion Sash",
      "Lórien Revealed",
      "Emry, Lurker of the Loch",
      "Cryptic Command",
      "Floodfarm Verge",
      "Porcelain Legionnaire",
      "Batterskull",
      "Phyrexian Metamorph",
      "Eiganjo, Seat of the Empire",
      "Giver of Runes",
      "Skrelv, Defector Mite",
      "Mox Opal",
      "Kappa Cannoneer",
      "Arcbound Ravager",
      "Steel Overseer",
      "Mana Confluence",
      "Karn, Scion of Urza",
      "Invasion of Gobakhan",
      "Gideon, Ally of Zendikar",
      "Shadowspear",
      "Oblivion Ring",
      "Syr Ginger, the Meal Ender",
      "Celestial Armor",
      "Etched Champion",
      "Collective Effort"
    ],
    "Diddi": [
      "Fury",
      "Arid Mesa",
      "Flooded Strand",
      "Icetill Explorer",
      "Stock Up",
      "Malevolent Rumble",
      "Vibrance",
      "Stomping Ground",
      "Uro, Titan of Nature's Wrath",
      "Raugrin Triome",
      "Leyline Binding",
      "Temple Garden",
      "Ketria Triome",
      "Meticulous Archive",
      "Six",
      "Once Upon a Time",
      "Condescend",
      "Wrenn and Six",
      "Pyroclasm",
      "Primeval Titan",
      "Endurance",
      "Dark Depths",
      "Thespian's Stage",
      "Sentinel of the Nameless City",
      "Growth Spiral",
      "Formidable Speaker",
      "Trumpeting Carnosaur",
      "Explore",
      "Explore",
      "Emrakul, the Promised End",
      "Smuggler's Surprise",
      "Thornspire Verge",
      "Waterlogged Grove",
      "Spellskite",
      "Herd Migration",
      "Bonny Pall, Clearcutter",
      "Haywire Mite"
    ],
    "Atli": [
      "Dismember",
      "Cori-Steel Cutter",
      "Scalding Tarn",
      "Unholy Heat",
      "Stormchaser's Talent",
      "Wooded Foothills",
      "Blood Crypt",
      "Dragon's Rage Channeler",
      "Burst Lightning",
      "Flow State",
      "Expressive Iteration",
      "Zagoth Triome",
      "Preordain",
      "Spirebluff Canal",
      "Slickshot Show-Off",
      "Opt",
      "Galvanic Blast",
      "Riverpyre Verge",
      "Light Up the Stage",
      "Monastery Swiftspear",
      "Soul-Scar Mage",
      "Murktide Regent",
      "Harmonic Prodigy",
      "Guttersnipe",
      "Ghost Vacuum",
      "Dreadbore",
      "Fatal Push",
      "Flame of Anor",
      "Kitsa, Otterball Elite",
      "Inquisition of Kozilek",
      "Darkslick Shores",
      "Gut Shot",
      "Blazemire Verge",
      "This Town Ain't Big Enough",
      "Kaito, Bane of Nightmares",
      "Serum Visions",
      "Seal of Fire"
    ],
    "Óli": [
      "Lightning Bolt",
      "Tamiyo, Inquisitive Student",
      "Polluted Delta",
      "Misty Rainforest",
      "Snapcaster Mage",
      "Flame Slash",
      "Sear",
      "Xander's Lounge",
      "Thundering Falls",
      "Abrade",
      "Chart a Course",
      "Vapor Snag",
      "Three Steps Ahead",
      "Consider",
      "Counterspell",
      "Thrill of Possibility",
      "Spell Pierce",
      "Ledger Shredder",
      "Brazen Borrower",
      "Young Pyromancer",
      "Stern Scolding",
      "Disallow",
      "Bedlam Reveler",
      "Bonecrusher Giant",
      "Manamorphose",
      "Fiery Islet",
      "Sweltering Suns",
      "Third Path Iconoclast",
      "Chandra, Torch of Defiance",
      "Vendilion Clique",
      "Jace, the Mind Sculptor",
      "Wan Shi Tong, Librarian",
      "Archmage's Charm",
      "Eddymurk Crab",
      "Big Score"
    ],
    "Aron Ívars.": [
      "Ajani, Nacatl Pariah",
      "Orcish Bowmasters",
      "Ocelot Pride",
      "Bloodstained Mire",
      "Phlage, Titan of Fire's Fury",
      "Voice of Victory",
      "Sacred Foundry",
      "Godless Shrine",
      "Inti, Seneschal of the Sun",
      "Smuggler's Copter",
      "Warleader's Call",
      "Goblin Rabblemaster",
      "Kolaghan's Command",
      "Savai Triome",
      "Tersa Lightshatter",
      "Faithless Looting",
      "Bitter Triumph",
      "Hangarback Walker",
      "Seasoned Pyromancer",
      "Cosmogrand Zenith",
      "Inspiring Vantage",
      "Cryptbreaker",
      "Goblin Bombardment",
      "Mayhem Devil",
      "Lingering Souls",
      "Eagles of the North",
      "Troll of Khazad-dûm",
      "Adeline, Resplendent Cathar",
      "Hellrider",
      "Anguished Unmaking",
      "Lightning Helix",
      "Silent Clearing",
      "Sunbaked Canyon",
      "Preacher of the Schism",
      "Sheoldred, the Apocalypse"
    ],
    "Aron Freyr": [
      "Phelia, Exuberant Shepherd",
      "Fable of the Mirror-Breaker",
      "Guide of Souls",
      "Solitude",
      "Windswept Heath",
      "Quantum Riddler",
      "Prismatic Vista",
      "Breeding Pool",
      "Ephemerate",
      "Subtlety",
      "No More Lies",
      "Eternal Witness",
      "Path to Exile",
      "Spara's Headquarters",
      "Prismatic Ending",
      "Gitaxian Probe",
      "Sunbillow Verge",
      "Lose Focus",
      "Seachrome Coast",
      "Time Warp",
      "Force of Negation",
      "Multiversal Passage",
      "Omnath, Locus of Creation",
      "March of Otherworldly Light",
      "Wall of Omens",
      "Spell Queller",
      "Fabled Passage",
      "Restoration Angel",
      "Venser, Shaper Savant",
      "Hushwood Verge",
      "Willowrush Verge",
      "Noble Hierarch",
      "Flickerwisp",
      "Thragtusk",
      "Birthing Pod"
    ]
  },
  "remaining": [
    "Champion of the Parish",
    "Giant Killer",
    "Recruitment Officer",
    "Warden of the Inner Sky",
    "Kinscaer Sentry",
    "Luminarch Aspirant",
    "Regal Bunnicorn",
    "Thalia, Guardian of Thraben",
    "Thalia's Lieutenant",
    "Brimaz, King of Oreskos",
    "Elite Spellbinder",
    "Fiend Hunter",
    "Monastery Mentor",
    "Skyclave Apparition",
    "Thalia, Heretic Cathar",
    "Welcoming Vampire",
    "Hero of Bladehold",
    "Archangel Avacyn",
    "Archangel of Thune",
    "Knight-Errant of Eos",
    "Reveillark",
    "Venerated Loxodon",
    "Sun Titan",
    "Overlord of the Mistmoors",
    "The Wandering Emperor",
    "Elspeth, Sun's Champion",
    "Secure the Wastes",
    "Get Lost",
    "Rally the Monastery",
    "Settle the Wreckage",
    "Recommission",
    "Wrath of God",
    "Spectral Procession",
    "Legion's Landing",
    "Wedding Announcement",
    "Elspeth Conquers Death",
    "Virtue of Loyalty",
    "Flitterwing Nuisance",
    "Pteramander",
    "Spectral Sailor",
    "Faerie Mastermind",
    "Picklock Prankster",
    "Thing in the Ice",
    "Abhorrent Oculus",
    "Aether Channeler",
    "Champion of Wits",
    "Pestermite",
    "Dungeon Geists",
    "Sower of Temptation",
    "Body Double",
    "Marang River Regent",
    "Torrential Gearhulk",
    "Hullbreaker Horror",
    "Thought Monitor",
    "Elder Deep-Fiend",
    "Tamiyo, the Moon Sage",
    "Thought Scour",
    "Consult the Star Charts",
    "Gifts Ungiven",
    "Dig Through Time",
    "Search for Azcanta",
    "Shark Typhoon",
    "Cecil, Dark Knight",
    "Gravecrawler",
    "Moonshadow",
    "Nethergoyf",
    "Stitcher's Supplier",
    "Accursed Marauder",
    "Bloodghast",
    "Dauthi Voidwalker",
    "Pack Rat",
    "Priest of Forgotten Gods",
    "Tenacious Underdog",
    "Vampire Hexmage",
    "Zulaport Cutthroat",
    "Midnight Reaper",
    "Murderous Rider",
    "Plaguecrafter",
    "Rotting Regisaur",